section,item,status,evidence,issue,recommendation
Repository structure,Required directories exist,Pass,"docs/; scenario_map/; tools/; templates/; third_party/; reports/; examples/; assets/","None","No action required"
Repository structure,Required base files exist,Pass,"README.md; LICENSE; LICENSE-NOTICE.md; .gitignore; requirements.txt","None","No action required"
Repository structure,No unrelated source files,Pass,"git ls-files --others --exclude-standard shows intended project files only","No generated artifacts remain after cleanup","Keep generated artifacts uncommitted; review git status before publishing"
Repository structure,No copied third-party source tree,Pass,"third_party/ contains only third_party/README.md","None found","Keep third_party/*/ ignored or external"
README,Project introduction,Pass,"README.md:1-5","None","No action required"
README,Why the project exists,Pass,"README.md:26-30","None","No action required"
README,Problems solved,Pass,"README.md:32-39","None","No action required"
README,Architecture diagram,Pass,"README.md:41-67","None","No action required"
README,Repository structure section,Pass,"README.md:69-81","None","No action required"
README,Main capabilities,Pass,"README.md:83-126","None","No action required"
README,Third-party integration notes,Pass,"README.md:128-139","None","No action required"
README,License boundaries,Pass,"README.md:141-145","None","No action required"
README,Implemented content,Pass,"README.md:147-155","None","No action required"
README,Future extensions,Pass,"README.md future extensions section","CI exists; future items are correctly scoped as extensions","No action required"
README,Professional interview-ready style,Pass,"README.md full file","No inflated or unsupported claims found","No action required"
Third-party notes,openMSL entry complete,Pass,"third_party/README.md:7-16","Legal sufficiency unable to verify","Keep upstream URL, commit, and license with any local checkout"
Third-party notes,Vector OSC-NCAP entry complete,Pass,"third_party/README.md:18-27","Legal sufficiency unable to verify","Keep upstream URL, commit, and license with any local checkout"
Third-party notes,esmini entry complete,Pass,"third_party/README.md:29-38","Legal sufficiency unable to verify","Keep upstream URL, commit, and license with any local executable or source checkout"
Third-party notes,BeamNG NCAP entry complete,Pass,"third_party/README.md:40-49","Legal sufficiency unable to verify","Keep BeamNG.tech product terms separate from this repository"
Third-party notes,No implication of vendored upstream source,Pass,"third_party/README.md:3-5 and 51-64","None","No action required"
Scenario mapping,regulation_to_scenario_template.csv exists,Pass,"scenario_map/regulation_to_scenario_template.csv","None","No action required"
Scenario mapping,ncap_scenario_catalog_template.csv exists,Pass,"scenario_map/ncap_scenario_catalog_template.csv","None","No action required"
Scenario mapping,Required CSV fields present,Pass,"Both scenario_map CSV headers contain all required fields","None","No action required"
Scenario mapping,Field definitions clear,Pass,"scenario_map/field_definition.md:1-28","None","No action required"
Methodology,Scenario expression rationale covered,Pass,"docs/methodology.md:5-17","None","No action required"
Methodology,Regulation-to-scenario mapping rationale covered,Pass,"docs/methodology.md:19-32","None","No action required"
Methodology,Proving-ground and simulation linkage covered,Pass,"docs/methodology.md:34-45","None","No action required"
Methodology,Result closure importance covered,Pass,"docs/methodology.md:47-54","None","No action required"
Tools,Python syntax valid,Pass,"AST parse succeeded for 4 scripts","None","No action required"
Tools,build_scenario_index.py present and runnable,Pass,"tools/build_scenario_index.py; audit output /tmp/adas_audit_scenario_index","Markdown output now includes file_path and detected_parameters","No action required"
Tools,extract_xosc_params.py present and runnable,Pass,"tools/extract_xosc_params.py; audit output /tmp/adas_audit_xosc_parameter_summary.csv","None","No action required"
Tools,run_esmini_batch.py present and runnable,Pass,"tools/run_esmini_batch.py; audit output /tmp/adas_audit_run_plan.md","Dry-run only by design","Keep README wording explicit until real execution mode exists"
Tools,export_result_summary.py present and runnable,Pass,"tools/export_result_summary.py; audit output /tmp/adas_audit_result_summary","Minimal CSV schema assumptions","Document expected input schemas if the tool grows"
Templates,test_execution_record.md exists,Pass,"templates/test_execution_record.md","None","No action required"
Templates,issue_tracking_template.csv exists,Pass,"templates/issue_tracking_template.csv","None","No action required"
Templates,regression_verification_record.md exists,Pass,"templates/regression_verification_record.md","None","No action required"
Templates,regulation_to_scenario_review.md exists,Pass,"templates/regulation_to_scenario_review.md","None","No action required"
Templates,test_day_checklist.md exists,Pass,"templates/test_day_checklist.md","None","No action required"
Templates,Required workflow elements covered,Pass,"templates/ collectively cover pre-checks, scenario info, versions, environment, execution, abnormal observations, responsibility, closure, regression","Elements are distributed across templates","Optional: add templates/README.md with usage order"
Examples,example_scenario_list.csv exists and matches tools,Pass,"examples/example_scenario_list.csv used by run_esmini_batch.py","Two rows reuse one synthetic XOSC","Optional: add another synthetic XOSC"
Examples,example_result_input.csv exists and matches tools,Pass,"examples/example_result_input.csv used by export_result_summary.py","None","No action required"
Examples,example_issue_log.csv exists and matches tools,Pass,"examples/example_issue_log.csv used by export_result_summary.py","None","No action required"
Examples,No copied third-party scenario file found,Pass,"examples/minimal_aeb_scenario.xosc is synthetic and authored for this toolkit","Unable to prove negative beyond content scan","Continue using synthetic or clearly attributed external examples"
License,MIT LICENSE exists,Pass,"LICENSE","None","No action required"
License,LICENSE-NOTICE separates original and third-party content,Pass,"LICENSE-NOTICE.md:3-31","Legal sufficiency unable to verify","Review with legal counsel for commercial use"
License,requirements.txt minimal,Pass,"requirements.txt states standard-library-only tools","None","No action required"
License,Third-party attribution boundary clear,Pass,"LICENSE-NOTICE.md and third_party/README.md","None for current content","Keep upstream licenses with any future external checkout"
Overall,Project positioning clear,Pass,"README.md:1-39","None","No action required"
Overall,Engineering workflow complete,Pass,"scenario_map/; tools/; templates/; examples/","Execution wrapper is dry-run only","Real execution can be future work"
Overall,Public release readiness,Pass,"Source files are coherent, generated outputs are ignored, CI exists","No blocking issue","Publish intended source files only"
Overall,Final verdict,Pass,"Audit conclusion after remediation: Ready to publish","Remaining items are optional refinements","Proceed with initial public push"
